{
  "$schema": "../schema/content.schema.json",
  "meta": {
    "title": {
      "en": "How the EU AI Act Works — A Practical Breakdown",
      "fr": "Comment fonctionne l'AI Act de l'UE — guide pratique"
    },
    "brand": {
      "en": "EU AI Act · Explained",
      "fr": "AI Act UE · Expliqué"
    },
    "theme": "minimal-editorial",
    "format": "scroll",
    "languages": [
      { "code": "en", "label": "English" },
      { "code": "fr", "label": "Français" }
    ],
    "fallback": "en"
  },
  "nav": [
    { "id": "idea", "label": { "en": "The big idea", "fr": "L'idée centrale" } },
    { "id": "pyramid", "label": { "en": "Risk tiers", "fr": "Niveaux de risque" } },
    { "id": "classify", "label": { "en": "Classify it", "fr": "Classer" } },
    { "id": "banned", "label": { "en": "Banned uses", "fr": "Usages interdits" } },
    { "id": "highrisk", "label": { "en": "High-risk", "fr": "Haut risque" } },
    { "id": "gpai", "label": { "en": "General-purpose AI", "fr": "IA à usage général" } },
    { "id": "penalties", "label": { "en": "Penalties", "fr": "Sanctions" } },
    { "id": "timeline", "label": { "en": "Timeline", "fr": "Calendrier" } },
    { "id": "quiz", "label": { "en": "Quiz", "fr": "Quiz" } }
  ],
  "hero": {
    "eyebrow": { "en": "A practical breakdown", "fr": "Un guide pratique" },
    "headline": {
      "en": "How the EU AI Act works",
      "fr": "Comment fonctionne l'AI Act de l'UE"
    },
    "lede": {
      "en": "The world's first comprehensive law for artificial intelligence. The trick to understanding it: it doesn't regulate the technology — it regulates what you <em>do</em> with it, and the rules scale with the risk.",
      "fr": "La première grande loi mondiale sur l'intelligence artificielle. L'essentiel : elle ne régule pas la technologie en soi — elle régule ce que vous <em>en faites</em>, et les règles suivent le niveau de risque."
    },
    "stats": [
      { "value": "2024", "label": { "en": "In force since 1 Aug", "fr": "En vigueur depuis le 1<sup>er</sup> août" } },
      { "value": "4", "label": { "en": "Risk tiers", "fr": "Niveaux de risque" } },
      { "value": "€35M", "label": { "en": "Top fine, or 7% of turnover", "fr": "Amende max., ou 7 % du CA" } },
      { "value": "2025–28", "label": { "en": "Phasing in", "fr": "Entrée en vigueur progressive" } }
    ]
  },
  "quiz": [
    {
      "q": "What does the EU AI Act primarily regulate?",
      "options": [
        "The AI technology itself",
        "How AI is used, by risk level",
        "Only large language models",
        "AI made by European companies"
      ],
      "answer": 1,
      "why": "The Act is risk- and use-based: the same technology can be minimal-risk or banned depending on what it's used for."
    },
    {
      "q": "A company uses AI to rank job applicants. Which tier?",
      "options": [
        "Minimal — no rules",
        "Limited — just disclose",
        "High risk — full obligations",
        "Banned"
      ],
      "answer": 2,
      "why": "Employment is an Annex III area, so hiring tools are high-risk and carry the heaviest set of obligations."
    },
    {
      "q": "Which of these is outright banned?",
      "options": [
        "A customer-service chatbot",
        "General social scoring of citizens",
        "A high-risk hiring tool",
        "An AI spam filter"
      ],
      "answer": 1,
      "why": "Social scoring is one of the eight prohibited practices under Article 5 — there's no compliance path for it."
    },
    {
      "q": "What's the maximum fine for using a banned practice?",
      "options": [
        "€7.5M or 1% of turnover",
        "€15M or 3% of turnover",
        "€35M or 7% of turnover",
        "€100M flat"
      ],
      "answer": 2,
      "why": "Banned-practice breaches carry the top fine: €35M or 7% of global annual turnover, whichever is higher."
    },
    {
      "q": "Your company is in the US. When does the Act apply to you?",
      "options": [
        "Never — it's EU-only",
        "When your system's output is used in the EU",
        "Only if you have an EU office",
        "Only for GPAI models"
      ],
      "answer": 1,
      "why": "The Act applies extraterritorially: if your AI's output is used in the EU, you're in scope wherever you're based."
    }
  ],
  "sources": {
    "title": "Where this comes from",
    "items": [
      {
        "label": "High-level summary of the AI Act",
        "url": "https://artificialintelligenceact.eu/high-level-summary/",
        "note": "Future of Life Institute (risk tiers, prohibited list, Annex III, GPAI duties)"
      },
      {
        "label": "Implementation Timeline",
        "url": "https://artificialintelligenceact.eu/implementation-timeline/"
      },
      {
        "label": "Article 5 — Prohibited AI Practices",
        "url": "https://artificialintelligenceact.eu/article/5/"
      },
      {
        "label": "Article 99 — Penalties",
        "url": "https://artificialintelligenceact.eu/article/99/"
      },
      {
        "label": "European Commission — AI Act regulatory framework",
        "url": "https://digital-strategy.ec.europa.eu/en/policies/regulatory-framework-ai"
      },
      {
        "label": "Council of the EU — Digital Omnibus provisional agreement (7 May 2026)",
        "url": "https://www.consilium.europa.eu/en/press/press-releases/2026/05/07/artificial-intelligence-council-and-parliament-agree-to-simplify-and-streamline-rules/"
      }
    ],
    "disclaimer": "This is an educational explainer, not legal advice. The EU AI Act is long and evolving; specific obligations depend on facts and on guidance still being issued. Consult the official text and qualified counsel for compliance decisions."
  },
  "footer": "Built as a plain-language guide to Regulation (EU) 2024/1689. Facts verified against EU and Future of Life Institute primary sources, June 2026.",
  "sections": [
    {
      "id": "idea",
      "type": "model",
      "pull": "The Act is a <em>sorting machine</em>. Every AI system gets dropped in by its risk, and the weight of the rules matches the tier it lands in.",
      "paragraphs": [
        "Most people expect a law that says \"here are the rules for AI.\" The EU AI Act is built differently. It asks one question about each system — <strong>how much risk does this particular use create for people's rights and safety?</strong> — and sorts it into one of four tiers.",
        "This is why the <em>same</em> piece of technology can sit in totally different tiers. A face-matching model is minimal-risk when it unlocks your phone, high-risk when it screens job applicants, and outright banned when it scrapes the open web to build a surveillance database."
      ],
      "examplesTitle": "Same tech · different use · different tier",
      "examplesLabel": "Same technology, different risk tiers depending on use",
      "examples": [
        { "tool": "Face recognition", "use": "unlocking your phone", "tier": "Minimal", "tone": "green" },
        { "tool": "Face recognition", "use": "screening job applicants", "tier": "High-risk", "tone": "amber" },
        { "tool": "Face recognition", "use": "scraping the web for a DB", "tier": "Banned", "tone": "red" },
        { "tool": "A chatbot", "use": "answering FAQs", "tier": "Limited", "tone": "blue" }
      ]
    },
    {
      "id": "pyramid",
      "type": "tier-cards",
      "band": true,
      "num": "01 — THE FOUR TIERS",
      "title": "The risk pyramid",
      "intro": "The fewer the systems in a tier, the heavier its rules. A tiny number of uses are banned at the top; the vast majority of everyday AI sits unregulated at the bottom. Click any tier to open it.",
      "items": [
        {
          "cls": "t-prohibited",
          "width": "tw1",
          "tag": "Tier 1",
          "name": "Unacceptable — Banned",
          "sub": "A clear threat to rights. Prohibited outright.",
          "body": [
            "Social scoring of people by behaviour or traits",
            "Manipulative or exploitative systems that cause harm",
            "Untargeted scraping of faces to build recognition databases",
            "Emotion recognition at work or school",
            "Most real-time facial recognition in public by police"
          ],
          "note": "8 categories in total — see \"The eight banned uses\" below."
        },
        {
          "cls": "t-high",
          "width": "tw2",
          "tag": "Tier 2",
          "name": "High risk — Regulated",
          "sub": "Allowed, but with heavy obligations. Most of the Act.",
          "body": [
            "Used in hiring, credit, education, essential services, law enforcement, migration, justice…",
            "…or as a safety part of a regulated product (medical devices, machinery, cars)",
            "Provider must do risk management, data governance, documentation, human oversight, testing, registration"
          ],
          "note": "Roughly 8 sensitive areas listed in Annex III."
        },
        {
          "cls": "t-limited",
          "width": "tw3",
          "tag": "Tier 3",
          "name": "Limited risk — Transparency",
          "sub": "Just be honest that it's AI.",
          "body": [
            "Chatbots must tell users they're talking to a machine",
            "AI-generated images, audio and video (deepfakes) must be labelled",
            "Synthetic content must be machine-readable as AI-generated"
          ],
          "note": "Light-touch: disclosure, not heavy compliance."
        },
        {
          "cls": "t-minimal",
          "width": "tw4",
          "tag": "Tier 4",
          "name": "Minimal risk — Free",
          "sub": "No special obligations. The vast majority of AI.",
          "body": [
            "Spam filters, recommendation engines, AI in video games",
            "Inventory and logistics optimisation",
            "The bulk of AI products on the market today"
          ],